{
  "storyboard_id": "STORYBOARD_20260402_092412_d66e8f57",
  "timestamp": "2026-04-02T15:24:12.536076+00:00",
  "status": "healthy",
  "source_pack": "PACK_20260402_092203_25a2677d",
  "storyboards": [
    {
      "script_id": "SCR_b15ee7594d0b",
      "frames": [
        {
          "frame_id": "FRAME_b15ee759_001",
          "scene_id": "SCENE_01",
          "asset_id": "ASSET_b15ee759_thumbnail_00_9e1560ad",
          "timecode": "00:00:00:00",
          "description": "YouTube video thumbnail, AI system learns to keep warehouse robot traffic r, professional style, pro",
          "camera": "straight-on, eye-level",
          "composition": "hero subject center-left, text space right",
          "notes": "Style: clean lines, corporate aesthetic"
        },
        {
          "frame_id": "FRAME_b15ee759_002",
          "scene_id": "SCENE_01",
          "asset_id": "ASSET_b15ee759_intro_card_00_9fdfe277",
          "timecode": "00:00:03:00",
          "description": "Video intro title card, AI system learns to keep warehouse robot traffic r, professional motion grap",
          "camera": "wide establishing shot",
          "composition": "cinematic letterbox, title centered",
          "notes": "Style: clean lines, corporate aesthetic"
        },
        {
          "frame_id": "FRAME_b15ee759_003",
          "scene_id": "SCENE_01",
          "asset_id": "ASSET_b15ee759_lower_third_00_ca5b8643",
          "timecode": "00:00:06:00",
          "description": "Lower third graphic, HOOK: Hook, professional style, semi-transparent background, modern typography,",
          "camera": "rule of thirds, lower frame",
          "composition": "clean lower 20%, transparent overlay",
          "notes": "Style: clean lines, corporate aesthetic"
        },
        {
          "frame_id": "FRAME_b15ee759_004",
          "scene_id": "SCENE_02",
          "asset_id": "ASSET_b15ee759_lower_third_01_8793e4d8",
          "timecode": "00:00:08:00",
          "description": "Lower third graphic, CONTEXT: Intro, professional style, semi-transparent background, modern typogra",
          "camera": "rule of thirds, lower frame",
          "composition": "clean lower 20%, transparent overlay",
          "notes": "Style: clean lines, corporate aesthetic"
        },
        {
          "frame_id": "FRAME_b15ee759_005",
          "scene_id": "SCENE_02",
          "asset_id": "ASSET_b15ee759_lower_third_02_a00efe88",
          "timecode": "00:00:10:00",
          "description": "Lower third graphic, STEP_1: Step 1, professional style, semi-transparent background, modern typogra",
          "camera": "rule of thirds, lower frame",
          "composition": "clean lower 20%, transparent overlay",
          "notes": "Style: clean lines, corporate aesthetic"
        },
        {
          "frame_id": "FRAME_b15ee759_006",
          "scene_id": "SCENE_02",
          "asset_id": "ASSET_b15ee759_broll_00_bc894730",
          "timecode": "00:00:12:00",
          "description": "B-roll footage, Attention-grabbing tech visuals, glitch effects, professional cinematography, profes",
          "camera": "dynamic movement, dolly",
          "composition": "dynamic framing, motion-safe margins",
          "notes": "Style: clean lines, corporate aesthetic"
        },
        {
          "frame_id": "FRAME_b15ee759_007",
          "scene_id": "SCENE_03",
          "asset_id": "ASSET_b15ee759_broll_01_f9d503a5",
          "timecode": "00:00:17:00",
          "description": "B-roll footage, Professional tech environment, screens with code, professional cinematography, profe",
          "camera": "dynamic movement, dolly",
          "composition": "dynamic framing, motion-safe margins",
          "notes": "Style: clean lines, corporate aesthetic"
        },
        {
          "frame_id": "FRAME_b15ee759_008",
          "scene_id": "SCENE_03",
          "asset_id": "ASSET_b15ee759_broll_02_49dd93cd",
          "timecode": "00:00:22:00",
          "description": "B-roll footage, Tutorial-style screen capture, step indicators, professional cinematography, profess",
          "camera": "dynamic movement, dolly",
          "composition": "dynamic framing, motion-safe margins",
          "notes": "Style: clean lines, corporate aesthetic"
        },
        {
          "frame_id": "FRAME_b15ee759_009",
          "scene_id": "SCENE_03",
          "asset_id": "ASSET_b15ee759_broll_03_9362830b",
          "timecode": "00:00:27:00",
          "description": "B-roll footage, Tutorial-style screen capture, step indicators, professional cinematography, profess",
          "camera": "dynamic movement, dolly",
          "composition": "dynamic framing, motion-safe margins",
          "notes": "Style: clean lines, corporate aesthetic"
        },
        {
          "frame_id": "FRAME_b15ee759_010",
          "scene_id": "SCENE_04",
          "asset_id": "ASSET_b15ee759_broll_04_42e296d4",
          "timecode": "00:00:32:00",
          "description": "B-roll footage, Tutorial-style screen capture, step indicators, professional cinematography, profess",
          "camera": "dynamic movement, dolly",
          "composition": "dynamic framing, motion-safe margins",
          "notes": "Style: clean lines, corporate aesthetic"
        },
        {
          "frame_id": "FRAME_b15ee759_011",
          "scene_id": "SCENE_04",
          "asset_id": "ASSET_b15ee759_title_card_00_122e7ee7",
          "timecode": "00:00:37:00",
          "description": "Section title card, HOOK: Hook, professional design, minimal clean layout, clean lines, corporate ae",
          "camera": "centered frame",
          "composition": "centered text, decorative borders",
          "notes": "Style: clean lines, corporate aesthetic"
        },
        {
          "frame_id": "FRAME_b15ee759_012",
          "scene_id": "SCENE_04",
          "asset_id": "ASSET_b15ee759_title_card_01_f63b6c82",
          "timecode": "00:00:39:00",
          "description": "Section title card, CONTEXT: Intro, professional design, minimal clean layout, clean lines, corporat",
          "camera": "centered frame",
          "composition": "centered text, decorative borders",
          "notes": "Style: clean lines, corporate aesthetic"
        },
        {
          "frame_id": "FRAME_b15ee759_013",
          "scene_id": "SCENE_05",
          "asset_id": "ASSET_b15ee759_title_card_02_1d5279e2",
          "timecode": "00:00:41:00",
          "description": "Section title card, STEP_1: Step 1, professional design, minimal clean layout, clean lines, corporat",
          "camera": "centered frame",
          "composition": "centered text, decorative borders",
          "notes": "Style: clean lines, corporate aesthetic"
        },
        {
          "frame_id": "FRAME_b15ee759_014",
          "scene_id": "SCENE_05",
          "asset_id": "ASSET_b15ee759_end_card_00_4ae178b5",
          "timecode": "00:00:43:00",
          "description": "YouTube end screen, subscribe CTA, professional style, engaging call to action, clean lines, corpora",
          "camera": "centered with space for overlays",
          "composition": "subscribe button zones, card slots",
          "notes": "Style: clean lines, corporate aesthetic"
        }
      ],
      "shotlist": [
        {
          "shot_id": "SHOT_b15ee759_001",
          "asset_type": "thumbnail",
          "duration": 3.0,
          "description": "YouTube video thumbnail, AI system learns to keep warehouse robot traffic r, pro",
          "priority": "critical"
        },
        {
          "shot_id": "SHOT_b15ee759_002",
          "asset_type": "intro_card",
          "duration": 3.0,
          "description": "Video intro title card, AI system learns to keep warehouse robot traffic r, prof",
          "priority": "high"
        },
        {
          "shot_id": "SHOT_b15ee759_003",
          "asset_type": "lower_third",
          "duration": 2.0,
          "description": "Lower third graphic, HOOK: Hook, professional style, semi-transparent background",
          "priority": "medium"
        },
        {
          "shot_id": "SHOT_b15ee759_004",
          "asset_type": "lower_third",
          "duration": 2.0,
          "description": "Lower third graphic, CONTEXT: Intro, professional style, semi-transparent backgr",
          "priority": "medium"
        },
        {
          "shot_id": "SHOT_b15ee759_005",
          "asset_type": "lower_third",
          "duration": 2.0,
          "description": "Lower third graphic, STEP_1: Step 1, professional style, semi-transparent backgr",
          "priority": "medium"
        },
        {
          "shot_id": "SHOT_b15ee759_006",
          "asset_type": "broll",
          "duration": 5.0,
          "description": "B-roll footage, Attention-grabbing tech visuals, glitch effects, professional ci",
          "priority": "medium"
        },
        {
          "shot_id": "SHOT_b15ee759_007",
          "asset_type": "broll",
          "duration": 5.0,
          "description": "B-roll footage, Professional tech environment, screens with code, professional c",
          "priority": "medium"
        },
        {
          "shot_id": "SHOT_b15ee759_008",
          "asset_type": "broll",
          "duration": 5.0,
          "description": "B-roll footage, Tutorial-style screen capture, step indicators, professional cin",
          "priority": "medium"
        },
        {
          "shot_id": "SHOT_b15ee759_009",
          "asset_type": "broll",
          "duration": 5.0,
          "description": "B-roll footage, Tutorial-style screen capture, step indicators, professional cin",
          "priority": "medium"
        },
        {
          "shot_id": "SHOT_b15ee759_010",
          "asset_type": "broll",
          "duration": 5.0,
          "description": "B-roll footage, Tutorial-style screen capture, step indicators, professional cin",
          "priority": "medium"
        },
        {
          "shot_id": "SHOT_b15ee759_011",